{
  "schema_version": "1.0.0",
  "report_id": "BX-BH01-PHASE9-RERUN-COMPARISON-ATTEMPT-1-0.1",
  "status": "observed-drift",
  "source_revision": "04f9eb1bd2b191d6b6a23202247201bce5d82855",
  "policy": {
    "median_relative_floor": 0.5,
    "p95_relative_floor": 0.75,
    "variance_multiplier_median": 3,
    "variance_multiplier_p95": 4,
    "near_zero_absolute_ms": 0.5,
    "excluded_metrics": [
      "BX-BH01-METRIC-CLOCK-RESOLUTION-MS",
      "BX-BH01-METRIC-RESOURCE-JS-HEAP-BYTES"
    ]
  },
  "inputs": [
    {
      "role": "primary",
      "path": "integration/benchmarks/raw-evidence/bh01-phase9-chromium-linux.json",
      "sha256": "49ca2f83a350534e28ce2c1889db05c658015b7083be2535da3e60d202afbaef",
      "environment_id": "BX-BH01-ENV-PHASE9-LINUX-CHROME-X64-0.1",
      "source_revision": "22dc98033893cdc85db142bd6a05650ab4032f52"
    },
    {
      "role": "representative-rerun",
      "path": "integration/benchmarks/raw-evidence/bh01-phase9-rerun-chromium-linux.json",
      "sha256": "2d97a3180c052f81d6a5eca5ad6ded408817d939aeb33e5940a03bf7a142f5e6",
      "environment_id": "BX-BH01-ENV-PHASE9-LINUX-CHROME-X64-0.1",
      "source_revision": "04f9eb1bd2b191d6b6a23202247201bce5d82855"
    },
    {
      "role": "primary",
      "path": "integration/benchmarks/raw-evidence/bh01-phase9-firefox-linux.json",
      "sha256": "a0d05b98ce400cecf40850baaf951bd09654e6ffba2a40418a79f941db6ba66d",
      "environment_id": "BX-BH01-ENV-PHASE9-LINUX-FIREFOX-X64-0.1",
      "source_revision": "22dc98033893cdc85db142bd6a05650ab4032f52"
    },
    {
      "role": "representative-rerun",
      "path": "integration/benchmarks/raw-evidence/bh01-phase9-rerun-firefox-linux.json",
      "sha256": "ab5c61460e3da319456285b5bf887863ccfb72a41c05d6470be846dc7a155c70",
      "environment_id": "BX-BH01-ENV-PHASE9-LINUX-FIREFOX-X64-0.1",
      "source_revision": "04f9eb1bd2b191d6b6a23202247201bce5d82855"
    }
  ],
  "identity_checks": [
    {
      "environment_id": "BX-BH01-ENV-PHASE9-LINUX-CHROME-X64-0.1",
      "browser_binary_match": true,
      "profile_manifest_match": true,
      "environment_match": true
    },
    {
      "environment_id": "BX-BH01-ENV-PHASE9-LINUX-FIREFOX-X64-0.1",
      "browser_binary_match": true,
      "profile_manifest_match": true,
      "environment_match": true
    }
  ],
  "comparisons": [
    {
      "environment_id": "BX-BH01-ENV-PHASE9-LINUX-CHROME-X64-0.1",
      "metric_id": "BX-BH01-METRIC-INTERACTION-DOM-COMMIT-MS",
      "scenario": "form-programmatic-update",
      "cache_state": "warm",
      "primary": {
        "count": 100,
        "median": 0.235,
        "p95": 0.385,
        "variance_percent": 43.702826
      },
      "rerun": {
        "count": 20,
        "median": 0.2625,
        "p95": 0.35,
        "variance_percent": 27.202658
      },
      "tolerance": {
        "median_relative": 1.311085,
        "p95_relative": 1.748113,
        "observed_median_relative_delta": 0.0,
        "observed_p95_relative_delta": 0.0
      },
      "status": "within-development-tolerance"
    },
    {
      "environment_id": "BX-BH01-ENV-PHASE9-LINUX-CHROME-X64-0.1",
      "metric_id": "BX-BH01-METRIC-INTERACTION-DOM-COMMIT-MS",
      "scenario": "nested-keyed-update",
      "cache_state": "warm",
      "primary": {
        "count": 100,
        "median": 0.245,
        "p95": 0.385,
        "variance_percent": 36.806095
      },
      "rerun": {
        "count": 20,
        "median": 0.31,
        "p95": 0.35,
        "variance_percent": 17.110757
      },
      "tolerance": {
        "median_relative": 1.104183,
        "p95_relative": 1.472244,
        "observed_median_relative_delta": 0.0,
        "observed_p95_relative_delta": 0.0
      },
      "status": "within-development-tolerance"
    },
    {
      "environment_id": "BX-BH01-ENV-PHASE9-LINUX-CHROME-X64-0.1",
      "metric_id": "BX-BH01-METRIC-INTERACTION-DOM-COMMIT-MS",
      "scenario": "parent-state-update",
      "cache_state": "warm",
      "primary": {
        "count": 100,
        "median": 0.24,
        "p95": 0.355,
        "variance_percent": 43.973694
      },
      "rerun": {
        "count": 20,
        "median": 0.105,
        "p95": 0.235,
        "variance_percent": 41.152751
      },
      "tolerance": {
        "median_relative": 1.319211,
        "p95_relative": 1.758948,
        "observed_median_relative_delta": 0.0,
        "observed_p95_relative_delta": 0.0
      },
      "status": "within-development-tolerance"
    },
    {
      "environment_id": "BX-BH01-ENV-PHASE9-LINUX-CHROME-X64-0.1",
      "metric_id": "BX-BH01-METRIC-INTERACTION-DOM-COMMIT-MS",
      "scenario": "timer-message-update",
      "cache_state": "warm",
      "primary": {
        "count": 100,
        "median": 0.2425,
        "p95": 0.34,
        "variance_percent": 26.278679
      },
      "rerun": {
        "count": 20,
        "median": 0.2225,
        "p95": 0.31,
        "variance_percent": 21.036845
      },
      "tolerance": {
        "median_relative": 0.78836,
        "p95_relative": 1.051147,
        "observed_median_relative_delta": 0.0,
        "observed_p95_relative_delta": 0.0
      },
      "status": "within-development-tolerance"
    },
    {
      "environment_id": "BX-BH01-ENV-PHASE9-LINUX-CHROME-X64-0.1",
      "metric_id": "BX-BH01-METRIC-INTERACTION-LOCAL-EVENT-PAINT-MS",
      "scenario": "form-programmatic-update",
      "cache_state": "warm",
      "primary": {
        "count": 100,
        "median": 46.5025,
        "p95": 47.325,
        "variance_percent": 36.215999
      },
      "rerun": {
        "count": 20,
        "median": 46.1225,
        "p95": 46.965,
        "variance_percent": 23.679288
      },
      "tolerance": {
        "median_relative": 1.08648,
        "p95_relative": 1.44864,
        "observed_median_relative_delta": 0.008172,
        "observed_p95_relative_delta": 0.007607
      },
      "status": "within-development-tolerance"
    },
    {
      "environment_id": "BX-BH01-ENV-PHASE9-LINUX-CHROME-X64-0.1",
      "metric_id": "BX-BH01-METRIC-INTERACTION-LOCAL-EVENT-PAINT-MS",
      "scenario": "nested-keyed-update",
      "cache_state": "warm",
      "primary": {
        "count": 100,
        "median": 32.24,
        "p95": 40.805,
        "variance_percent": 26.765267
      },
      "rerun": {
        "count": 20,
        "median": 34.855,
        "p95": 49.375,
        "variance_percent": 15.854945
      },
      "tolerance": {
        "median_relative": 0.802958,
        "p95_relative": 1.070611,
        "observed_median_relative_delta": 0.08111,
        "observed_p95_relative_delta": 0.210023
      },
      "status": "within-development-tolerance"
    },
    {
      "environment_id": "BX-BH01-ENV-PHASE9-LINUX-CHROME-X64-0.1",
      "metric_id": "BX-BH01-METRIC-INTERACTION-LOCAL-EVENT-PAINT-MS",
      "scenario": "parent-state-update",
      "cache_state": "warm",
      "primary": {
        "count": 100,
        "median": 31.215,
        "p95": 36.645,
        "variance_percent": 27.875289
      },
      "rerun": {
        "count": 20,
        "median": 15.3025,
        "p95": 32.155,
        "variance_percent": 31.409529
      },
      "tolerance": {
        "median_relative": 0.836259,
        "p95_relative": 1.115012,
        "observed_median_relative_delta": 0.509771,
        "observed_p95_relative_delta": 0.122527
      },
      "status": "within-development-tolerance"
    },
    {
      "environment_id": "BX-BH01-ENV-PHASE9-LINUX-CHROME-X64-0.1",
      "metric_id": "BX-BH01-METRIC-INTERACTION-LOCAL-EVENT-PAINT-MS",
      "scenario": "timer-message-update",
      "cache_state": "warm",
      "primary": {
        "count": 100,
        "median": 63.7225,
        "p95": 66.9,
        "variance_percent": 12.362721
      },
      "rerun": {
        "count": 20,
        "median": 63.255,
        "p95": 65.295,
        "variance_percent": 6.14295
      },
      "tolerance": {
        "median_relative": 0.5,
        "p95_relative": 0.75,
        "observed_median_relative_delta": 0.007336,
        "observed_p95_relative_delta": 0.023991
      },
      "status": "within-development-tolerance"
    },
    {
      "environment_id": "BX-BH01-ENV-PHASE9-LINUX-CHROME-X64-0.1",
      "metric_id": "BX-BH01-METRIC-INTERACTION-SERVER-ROUNDTRIP-MS",
      "scenario": "authenticated-success",
      "cache_state": "warm",
      "primary": {
        "count": 50,
        "median": 119.095,
        "p95": 138.005,
        "variance_percent": 22.991723
      },
      "rerun": {
        "count": 10,
        "median": 77.2275,
        "p95": 94.035,
        "variance_percent": 15.07465
      },
      "tolerance": {
        "median_relative": 0.689752,
        "p95_relative": 0.919669,
        "observed_median_relative_delta": 0.351547,
        "observed_p95_relative_delta": 0.318612
      },
      "status": "within-development-tolerance"
    },
    {
      "environment_id": "BX-BH01-ENV-PHASE9-LINUX-CHROME-X64-0.1",
      "metric_id": "BX-BH01-METRIC-INTERACTION-SERVER-ROUNDTRIP-MS",
      "scenario": "authorization-denial",
      "cache_state": "warm",
      "primary": {
        "count": 50,
        "median": 118.3025,
        "p95": 137.445,
        "variance_percent": 18.966899
      },
      "rerun": {
        "count": 10,
        "median": 61.8325,
        "p95": 78.095,
        "variance_percent": 16.492746
      },
      "tolerance": {
        "median_relative": 0.569007,
        "p95_relative": 0.758676,
        "observed_median_relative_delta": 0.477336,
        "observed_p95_relative_delta": 0.431809
      },
      "status": "within-development-tolerance"
    },
    {
      "environment_id": "BX-BH01-ENV-PHASE9-LINUX-CHROME-X64-0.1",
      "metric_id": "BX-BH01-METRIC-INTERACTION-SERVER-ROUNDTRIP-MS",
      "scenario": "disconnect-retry",
      "cache_state": "warm",
      "primary": {
        "count": 50,
        "median": 202.4525,
        "p95": 238.63,
        "variance_percent": 15.128203
      },